{
  "name": "Ray of Sickness",
  "level": 1,
  "school": "Necromancy",
  "casting_time": "1 action",
  "range": "60 feet",
  "components": [
    "V",
    "S"
  ],
  "duration": "Instantaneous",
  "description": "A ray of sickening green energy lashes out toward a creature within range. On a hit, the target must make a Constitution saving throw or be poisoned until the end of your next turn.",
  "classes": [
    "Sorcerer",
    "Wizard"
  ],
  "ritual": false
}
