{
  "name": "Spirit Shroud",
  "level": 3,
  "school": "Necromancy",
  "casting_time": "1 bonus action",
  "range": "Self",
  "components": [
    "V",
    "S"
  ],
  "duration": "Concentration, up to 1 minute",
  "description": "You call forth spirits of the dead, which flit around you for the spell's duration. The spirits are intangible and invulnerable. Until the spell ends, any attack you make deals 1d8 extra damage when you hit a creature within 10 feet of you. This damage is Radiant, Necrotic, or Cold (your choice when you cast the spell). Any creature that takes this damage can't regain Hit Points until the start of your next turn. In addition, any creature of your choice that you can see that starts its turn within 10 feet of you has its Speed reduced by 10 feet until the start of your next turn. Using a Higher-Level Spell Slot. The extra damage increases by 1d8 for every two spell slot levels above 3.",
  "classes": [
    "Cleric",
    "Paladin",
    "Warlock",
    "Wizard"
  ],
  "ritual": false
}
