{
  "name": "Light",
  "level": 0,
  "school": "Evocation",
  "casting_time": "1 action",
  "range": "Touch",
  "components": [
    "V",
    "M"
  ],
  "material": "a firefly or phosphorescent moss",
  "duration": "1 hour",
  "description": "You touch one object that is no larger than 10 feet in any dimension. Until the spell ends, the object sheds bright light in a 20-foot radius and dim light for an additional 20 feet.",
  "classes": [
    "Bard",
    "Cleric",
    "Sorcerer",
    "Wizard"
  ],
  "ritual": false
}
