{
  "name": "Prismatic Wall",
  "level": 9,
  "school": "Abjuration",
  "casting_time": "1 action",
  "range": "60 feet",
  "components": [
    "V",
    "S"
  ],
  "duration": "10 minutes",
  "description": "A shimmering, multicolored plane of light forms a vertical, opaque wall — up to 90 feet long, 30 feet high, and 1 inch thick — centered on a point you can see within range. Alternatively, you can shape the wall into a sphere up to 30 feet in diameter centered on a point you choose within range. The wall remains in place for the duration. If you position the wall so that it passes through a space occupied by a creature, the spell fails, and your action and the spell slot are wasted. The wall sheds Bright Light in a 100-foot radius and Dim Light for an additional 100 feet. The wall consists of seven layers, each with a different color. When a creature attempts to reach into or pass through the wall, it does so one layer at a time through all the wall's layers. Each layer has different effects.",
  "classes": [
    "Wizard"
  ],
  "ritual": false
}
