{
  "name": "Sunbeam",
  "level": 6,
  "school": "Evocation",
  "casting_time": "1 action",
  "range": "Self",
  "components": [
    "V",
    "S",
    "M (a magnifying glass)"
  ],
  "duration": "Concentration, up to 1 minute",
  "description": "A beam of brilliant light flashes out from your hand in a 5-foot-wide, 60-foot-long Line. Each creature in the line makes a Constitution saving throw. On a failed save, a creature takes 6d8 Radiant damage and has the Blinded condition until the start of your next turn. On a successful save, it takes half as much damage only. Undead and Oozes have Disadvantage on this saving throw. You can create a new line of radiance as a Magic action on your turn. For the duration, a mote of brilliant radiance shines above your hand. It sheds Bright Light in a 30-foot radius and Dim Light for an additional 30 feet. This light is sunlight.",
  "classes": [
    "Cleric",
    "Druid",
    "Sorcerer",
    "Wizard"
  ],
  "ritual": false
}
