{
  "name": "Awaken",
  "level": 5,
  "school": "Transmutation",
  "casting_time": "8 hours",
  "range": "Touch",
  "components": [
    "V",
    "S",
    "M"
  ],
  "material": "an agate worth 1,000+ GP, which the spell consumes",
  "duration": "Instantaneous",
  "description": "After spending the casting time tracing magical pathways within a precious gemstone, you touch a Huge or smaller Beast or Plant creature that has an Intelligence of 3 or less. The target must have no Humanoid features, and the touch must be maintained throughout the entire casting. The target gains an Intelligence of 10. The target also gains the ability to speak one language you know. The target is Charmed by you for 30 days or until you or your companions do anything harmful to it. When the Charmed condition ends, the awakened creature chooses whether to remain Friendly toward you.",
  "classes": [
    "Bard",
    "Druid"
  ],
  "ritual": false
}
