{
  "name": "Resistance",
  "level": 0,
  "school": "Abjuration",
  "casting_time": "1 action",
  "range": "Touch",
  "components": [
    "V",
    "S",
    "M"
  ],
  "material": "a miniature cloak",
  "duration": "Concentration, up to 1 minute",
  "description": "You touch one willing creature. Once before the spell ends, the target can roll a d4 and add the number rolled to one saving throw of its choice.",
  "classes": [
    "Cleric",
    "Druid"
  ],
  "ritual": false
}
