{
  "name": "Astral Projection",
  "level": 9,
  "school": "Necromancy",
  "casting_time": "1 hour",
  "range": "10 feet",
  "components": [
    "V",
    "S",
    "M (for each creature you affect with this spell, you must provide one jacinth worth 1,000+ GP and one ornately carved bar of silver worth 100+ GP, all of which the spell consumes)"
  ],
  "duration": "Until dispelled",
  "description": "You and up to eight willing creatures within range project your astral bodies into the Astral Plane. The material body you leave behind is Unconscious and in a state of suspended animation; it doesn't need food or air and doesn't age. Your astral body resembles your mortal form in almost every way, replicating your game statistics and possessions. The principal difference is the addition of a silvery cord that extends from between your shoulder blades and trails behind you, fading to invisibility after 1 foot. This cord is your tether to your material body. If the cord is cut — something that can happen only when an effect specifically states that it does — your soul and body are separated, killing you instantly.",
  "classes": [
    "Cleric",
    "Warlock",
    "Wizard"
  ],
  "ritual": false
}
