{
  "name": "Remove Curse",
  "level": 3,
  "school": "Abjuration",
  "casting_time": "1 action",
  "range": "Touch",
  "components": [
    "V",
    "S"
  ],
  "duration": "Instantaneous",
  "description": "At your touch, all curses affecting one creature or object end. If the object is a cursed magic item, its curse remains, but the spell breaks its owner's Attunement to the object so it can be removed or discarded.",
  "classes": [
    "Cleric",
    "Paladin",
    "Warlock",
    "Wizard"
  ],
  "ritual": false
}
