{
  "name": "Heroism",
  "level": 1,
  "school": "Enchantment",
  "casting_time": "1 action",
  "range": "Touch",
  "components": [
    "V",
    "S"
  ],
  "duration": "Concentration, up to 1 minute",
  "description": "A willing creature you touch is imbued with bravery. Until the spell ends, the creature is immune to the Frightened condition and gains Temporary Hit Points equal to your spellcasting ability modifier at the start of each of its turns. When the spell ends, the target loses any remaining Temporary Hit Points from this spell. At Higher Levels. When you cast this spell using a spell slot of 2nd level or higher, you can target one additional creature for each slot level above 1st.",
  "classes": [
    "Bard",
    "Paladin"
  ],
  "ritual": false
}
