{
  "name": "Speak with Plants",
  "level": 3,
  "school": "Transmutation",
  "casting_time": "1 action",
  "range": "Self (30-foot radius)",
  "components": [
    "V",
    "S"
  ],
  "duration": "10 minutes",
  "description": "You imbue plants within 30 feet of you with limited sentience and animation, giving them the ability to communicate with you and follow your simple commands. You can question plants about events in the spell's area within the past day, gaining information about creatures that have passed, weather, and other circumstances. You can also turn Difficult Terrain caused by plant growth (such as thickets and undergrowth) into ordinary terrain that lasts for the duration. Or you can turn ordinary terrain where plants are present into Difficult Terrain that lasts for the duration, causing vines and branches to hinder pursuers, for example. Plants might be unable to answer your questions if the events are outside their perception. This spell doesn't cause plants to uproot themselves and follow your commands.",
  "classes": [
    "Bard",
    "Druid",
    "Ranger"
  ],
  "ritual": false
}
