{
  "name": "Blade Ward",
  "level": 0,
  "school": "Abjuration",
  "casting_time": "1 action",
  "range": "Self",
  "components": [
    "V",
    "S"
  ],
  "duration": "Concentration, up to 1 minute",
  "description": "Whenever a creature makes an attack roll against you before the spell ends, the attacker subtracts 1d4 from the attack roll.",
  "classes": [
    "Bard",
    "Sorcerer",
    "Warlock",
    "Wizard"
  ],
  "ritual": false
}
